claim_id,paper,manuscript_location,claim_text,claim_type,status,evidence_run_ids,source_ids,statistical_support,limitations,reviewer_attack,owner
P1-C0,p1_toolmorph,,"All six strict transform families are state-transition-equivalent (byte-identical post-call snapshots over >15000 property cases, zero mismatch).",infrastructure,SUPPORTED,property_suite,,"equivalence suite: 0 mismatches",synthetic environments only,"transforms are artificial / not equivalent",yuke.z@wustl.edu
P1-H1,p1_toolmorph,sec6.2,"Enum-encoding causes a small paired success drop for both models (Claude -0.20, Codex -0.10).",empirical,PARTIAL,p1_pilot_2026-06-25,pipe2026,"directional, NOT significant: both bootstrap CIs include 0 (Claude [-0.50,0], Codex [-0.30,0]); n=10 single-seed; 1.0 ceiling","ceiling + 1-2 episodes; not significant",yuke.z@wustl.edu
P1-H3,p1_toolmorph,,"Degradation persists after matching schema tokens / content (not explained by length).",empirical,UNTESTED,,,,"content/legibility control not run","effect vanishes under content match -> claim fails",yuke.z@wustl.edu
P1-H4,p1_toolmorph,sec6.3,"Model ranking reverses across equivalent interfaces (Kendall tau < 1).",empirical,REFUTED,p1_pilot_2026-06-25,,"NOT supported: <=0.10 enum gap within bootstrap noise; needs >=6 model families + Kendall-tau","2 models cannot support a ranking claim",yuke.z@wustl.edu
P1-H5,p1_toolmorph,sec4,"A label-free STNF reduces degradation on held-out transforms vs the strongest non-oracle baseline.",method,UNTESTED,,tscg2026,,"PRIMARY claim, UNRUN -> pre-registered plan; static canonicalizer provably abstains on enum","STNF just reverts to original interface",yuke.z@wustl.edu
